{
  "schema_version": "slot-alignment.parameter-record.v6",
  "task_id": "<task-id>",
  "batch_id": "cv0001",
  "candidate_id": "<candidate-id>",
  "parameter_authority_sha256": "<sha256>",
  "parent_candidate_id": null,
  "changes": [
    {"parameter_id": "<parameter-id>", "runtime_path": "<runtime-json-path>", "value": "<value>"}
  ],
  "complete_parameters": [
    {"parameter_id": "<parameter-id>", "runtime_path": "<runtime-json-path>", "value": "<value>"}
  ],
  "parameter_sha256": "<sha256>",
  "runtime_bundle_sha256": "<sha256>",
  "runtime_files": [
    {"name": "game_core.json", "path": "<candidate-runtime-path>/game_core.json", "sha256": "<sha256>"},
    {"name": "payout_config.json", "path": "<candidate-runtime-path>/payout_config.json", "sha256": "<sha256>"},
    {"name": "reel_config.json", "path": "<candidate-runtime-path>/reel_config.json", "sha256": "<sha256>"},
    {"name": "symbol_catalog.json", "path": "<candidate-runtime-path>/symbol_catalog.json", "sha256": "<sha256>"}
  ],
  "created_at": "<ISO-8601>"
}
